{
  "$schema": "https://json-schema.org/draft-07/schema#",
  "version": "1.1.0",
  "descripcion": "Catálogo único de herramientas por rol. Reemplaza la duplicación que existía en 5 archivos del proyecto.",
  "roles": {
    "ABOGADO": {
      "descripcion": "Abogado litigante privado",
      "plan_minimo": "FREE",
      "herramientas": [
        { "slug": "analista-expedientes", "nombre": "Analista de Expedientes", "permiso": ["READ", "WRITE"], "endpoint": "/api/analista", "skill": "analizar-expediente", "agente": "ia-analista-expedientes" },
        { "slug": "objeciones", "nombre": "Asistente de Objeciones en Vivo", "permiso": ["READ"], "endpoint": "/api/objeciones", "skill": "asistente-objeciones", "agente": "ia-objeciones" },
        { "slug": "boveda", "nombre": "Bóveda de Evidencia Digital", "permiso": ["READ", "WRITE"], "endpoint": "/api/boveda", "skill": "boveda-custodia", "agente": "ia-boveda-evidencia" },
        { "slug": "buscador-jurisprudencia", "nombre": "Buscador de Jurisprudencia", "permiso": ["READ"], "endpoint": "/api/jurisprudencia", "skill": "buscar-jurisprudencia", "agente": "ia-buscador-jurisprudencia" },
        { "slug": "comparador-precendentes", "nombre": "Comparador de Precedentes", "permiso": ["READ"], "endpoint": "/api/comparador", "skill": "comparar-precendentes", "agente": "ia-comparador-precendentes" },
        { "slug": "estrategia-interrogatorio", "nombre": "Estrategia de Interrogatorio NCPP", "permiso": ["READ", "WRITE"], "endpoint": "/api/interrogatorio", "skill": "sugerir-pregunta-interrogatorio", "agente": "ia-estrategia-interrogatorio" },
        { "slug": "alegatos", "nombre": "Generador de Alegatos de Clausura", "permiso": ["READ", "WRITE"], "endpoint": "/api/alegatos", "skill": "redactar-alegato-clausura", "agente": "ia-generador-alegatos" },
        { "slug": "casos-criticos", "nombre": "Generador de Casos Críticos", "permiso": ["READ"], "endpoint": "/api/casos-criticos", "skill": "analizar-caso-critico", "agente": "ia-generador-casos-criticos" },
        { "slug": "multidoc", "nombre": "Gestión Multidocumento", "permiso": ["READ", "WRITE"], "endpoint": "/api/multidoc", "skill": "gestion-multidoc", "agente": "ia-gestion-multidoc" },
        { "slug": "monitor-sinoe", "nombre": "Monitor SINOE", "permiso": ["READ"], "endpoint": "/api/sinoe", "skill": "monitor-sinoe", "agente": "ia-monitor-sinoe" },
        { "slug": "predictor", "nombre": "Predictor Judicial", "permiso": ["READ"], "endpoint": "/api/predictor", "skill": "predecir-resultado", "agente": "ia-predictor-judicial" },
        { "slug": "redactor", "nombre": "Redactor de Escritos", "permiso": ["READ", "WRITE"], "endpoint": "/api/redactor", "skill": "redactar-demanda", "agente": "ia-redactor-escritos" },
        { "slug": "resumen-ejecutivo", "nombre": "Resumen Ejecutivo del Caso", "permiso": ["READ", "WRITE"], "endpoint": "/api/resumen", "skill": "resumir-caso", "agente": "ia-resumen-ejecutivo" },
        { "slug": "chat", "nombre": "Chat Legal", "permiso": ["READ", "WRITE"], "endpoint": "/api/chat", "skill": "chat-legal", "agente": "ia-chat-legal" },
        { "slug": "analizador_bancario", "nombre": "Analizador Bancario (Ley 26702)", "permiso": ["READ", "WRITE"], "endpoint": "/api/analizador_bancario", "skill": "analizar-bancario", "agente": "abogado-jr-bancario" },
        { "slug": "analizador_contrataciones", "nombre": "Analizador de Contrataciones del Estado (Ley 30225)", "permiso": ["READ", "WRITE"], "endpoint": "/api/analizador_contrataciones", "skill": "analizar-contrataciones", "agente": "abogado-jr-contrataciones" },
        { "slug": "analizador_aduanero", "nombre": "Analizador Aduanero (D.Leg. 1053)", "permiso": ["READ", "WRITE"], "endpoint": "/api/analizador_aduanero", "skill": "analizar-aduanero", "agente": "abogado-jr-aduanero" },
        { "slug": "analizador_competencia", "nombre": "Analizador de Libre Competencia (D.Leg. 1034)", "permiso": ["READ", "WRITE"], "endpoint": "/api/analizador_competencia", "skill": "analizar-competencia", "agente": "abogado-jr-competencia" },
        { "slug": "analizador_telecomunicaciones", "nombre": "Analizador de Telecomunicaciones (Ley 29904)", "permiso": ["READ", "WRITE"], "endpoint": "/api/analizador_telecomunicaciones", "skill": "analizar-telecomunicaciones", "agente": "abogado-jr-telecomunicaciones" },
        { "slug": "analizador_electoral", "nombre": "Analizador Electoral (Ley 26859)", "permiso": ["READ", "WRITE"], "endpoint": "/api/analizador_electoral", "skill": "analizar-electoral", "agente": "abogado-jr-electoral" },
        { "slug": "analizador_penitenciario", "nombre": "Analizador Penitenciario (D.Leg. 654)", "permiso": ["READ", "WRITE"], "endpoint": "/api/analizador_penitenciario", "skill": "analizar-penitenciario", "agente": "abogado-jr-penitenciario" },
        { "slug": "analizador_genero", "nombre": "Analizador de Violencia de Género (Ley 30364)", "permiso": ["READ", "WRITE"], "endpoint": "/api/analizador_genero", "skill": "analizar-genero", "agente": "abogado-jr-genero" },
        { "slug": "analizador_extranjeria", "nombre": "Analizador de Extranjería (D.Leg. 1350)", "permiso": ["READ", "WRITE"], "endpoint": "/api/analizador_extranjeria", "skill": "analizar-extranjeria", "agente": "abogado-jr-extranjeria" },
        { "slug": "analizador_previsional", "nombre": "Analizador Previsional (D.L. 19990)", "permiso": ["READ", "WRITE"], "endpoint": "/api/analizador_previsional", "skill": "analizar-previsional", "agente": "abogado-jr-previsional" },
        { "slug": "analizador_maritimo", "nombre": "Analizador Marítimo (Ley 27943)", "permiso": ["READ", "WRITE"], "endpoint": "/api/analizador_maritimo", "skill": "analizar-maritimo", "agente": "abogado-jr-maritimo" },
        { "slug": "analizador_aeronautico", "nombre": "Analizador Aeronáutico (Ley 27261)", "permiso": ["READ", "WRITE"], "endpoint": "/api/analizador_aeronautico", "skill": "analizar-aeronautico", "agente": "abogado-jr-aeronautico" },
        { "slug": "analizador_agrario", "nombre": "Analizador Agrario (D.Leg. 25902)", "permiso": ["READ", "WRITE"], "endpoint": "/api/analizador_agrario", "skill": "analizar-agrario", "agente": "abogado-jr-agrario" },
        { "slug": "analizador_pesca", "nombre": "Analizador Pesquero (Ley 25977)", "permiso": ["READ", "WRITE"], "endpoint": "/api/analizador_pesca", "skill": "analizar-pesca", "agente": "abogado-jr-pesca" },
        { "slug": "analizador_aguas", "nombre": "Analizador de Aguas (Ley 29338)", "permiso": ["READ", "WRITE"], "endpoint": "/api/analizador_aguas", "skill": "analizar-aguas", "agente": "abogado-jr-aguas" },
        { "slug": "analizador_forestal", "nombre": "Analizador Forestal (Ley 29763)", "permiso": ["READ", "WRITE"], "endpoint": "/api/analizador_forestal", "skill": "analizar-forestal", "agente": "abogado-jr-forestal" },
        { "slug": "analizador_datos_personales", "nombre": "Analizador de Protección de Datos Personales (Ley 29733)", "permiso": ["READ", "WRITE"], "endpoint": "/api/analizador_datos_personales", "skill": "analizar-datos-personales", "agente": "abogado-jr-datos-personales" },
        { "slug": "analizador_internacional", "nombre": "Analizador Internacional (D.Leg. 1776)", "permiso": ["READ", "WRITE"], "endpoint": "/api/analizador_internacional", "skill": "analizar-internacional", "agente": "abogado-jr-internacional" },
        { "slug": "analizador_municipal", "nombre": "Analizador Municipal (Ley 27972)", "permiso": ["READ", "WRITE"], "endpoint": "/api/analizador_municipal", "skill": "analizar-municipal", "agente": "abogado-jr-municipal" },
        { "slug": "analizador_ejecucion", "nombre": "Analizador de Ejecución Procesal (CPC)", "permiso": ["READ", "WRITE"], "endpoint": "/api/analizador_ejecucion", "skill": "analizar-ejecucion", "agente": "abogado-jr-ejecucion" },
        { "slug": "analizador_seguros", "nombre": "Analizador de Seguros (Ley 29946)", "permiso": ["READ", "WRITE"], "endpoint": "/api/analizador_seguros", "skill": "analizar-seguros", "agente": "abogado-jr-seguros" },
        { "slug": "analizador_ciberespacio", "nombre": "Analizador de Ciberespacio (Ley 30096)", "permiso": ["READ", "WRITE"], "endpoint": "/api/analizador_ciberespacio", "skill": "analizar-ciberespacio", "agente": "abogado-jr-ciberespacio" },
        { "slug": "analizador_deporte", "nombre": "Analizador Deportivo (Ley 28036)", "permiso": ["READ", "WRITE"], "endpoint": "/api/analizador_deporte", "skill": "analizar-deporte", "agente": "abogado-jr-deporte" },
        { "slug": "analizador_turismo", "nombre": "Analizador de Turismo (Ley 29408)", "permiso": ["READ", "WRITE"], "endpoint": "/api/analizador_turismo", "skill": "analizar-turismo", "agente": "abogado-jr-turismo" },
        { "slug": "analizador_militar", "nombre": "Analizador Militar (D.Leg. 961)", "permiso": ["READ", "WRITE"], "endpoint": "/api/analizador_militar", "skill": "analizar-militar", "agente": "abogado-jr-militar" },
        { "slug": "analizador_policial", "nombre": "Analizador Policial (Ley 27238)", "permiso": ["READ", "WRITE"], "endpoint": "/api/analizador_policial", "skill": "analizar-policial", "agente": "abogado-jr-policial" },
        { "slug": "analizador_cooperativo", "nombre": "Analizador Cooperativo (Ley 29683)", "permiso": ["READ", "WRITE"], "endpoint": "/api/analizador_cooperativo", "skill": "analizar-cooperativo", "agente": "abogado-jr-cooperativo" },
        { "slug": "analizador_cultura", "nombre": "Analizador de Cultura (Ley 28296)", "permiso": ["READ", "WRITE"], "endpoint": "/api/analizador_cultura", "skill": "analizar-cultura", "agente": "abogado-jr-cultura" },
        { "slug": "analizador_adulto_mayor", "nombre": "Analizador de Persona Adulta Mayor (Ley 30490)", "permiso": ["READ", "WRITE"], "endpoint": "/api/analizador_adulto_mayor", "skill": "analizar-adulto-mayor", "agente": "abogado-jr-adulto-mayor" },